Rank,Title,Genre,Description,Director,Actors,Year,Runtime (Minutes),Rating,Votes,Revenue (Millions),Metascore
51,Star Wars: Episode VII - The Force Awakens,"Action,Adventure,Fantasy","Three decades after the defeat of the Galactic Empire, a new threat arises. The First Order attempts to rule the galaxy and only a ragtag group of heroes can stop them, along with the help of the Resistance.",J.J. Abrams,"Daisy Ridley, John Boyega, Oscar Isaac, Domhnall Gleeson",2015,136,8.1,661608,936.63,81
88,Avatar,"Action,Adventure,Fantasy",A paraplegic marine dispatched to the moon Pandora on a unique mission becomes torn between following his orders and protecting the world he feels is his home.,James Cameron,"Sam Worthington, Zoe Saldana, Sigourney Weaver, Michelle Rodriguez",2009,162,7.8,935408,760.51,83
86,Jurassic World,"Action,Adventure,Sci-Fi","A new theme park, built on the original site of Jurassic Park, creates a genetically modified hybrid dinosaur, which escapes containment and goes on a killing spree.",Colin Trevorrow,"Chris Pratt, Bryce Dallas Howard, Ty Simpkins,Judy Greer",2015,124,7,455169,652.18,59
77,The Avengers,"Action,Sci-Fi",Earth's mightiest heroes must come together and learn to fight as a team if they are to stop the mischievous Loki and his alien army from enslaving humanity.,Joss Whedon,"Robert Downey Jr., Chris Evans, Scarlett Johansson,Jeremy Renner",2012,143,8.1,1045588,623.28,69
55,The Dark Knight,"Action,Crime,Drama","When the menace known as the Joker wreaks havoc and chaos on the people of Gotham, the Dark Knight must come to terms with one of the greatest psychological tests of his ability to fight injustice.",Christopher Nolan,"Christian Bale, Heath Ledger, Aaron Eckhart,Michael Caine",2008,152,9,1791916,533.32,82
13,Rogue One,"Action,Adventure,Sci-Fi","The Rebel Alliance makes a risky move to steal the plans for the Death Star, setting up the epic saga to follow.",Gareth Edwards,"Felicity Jones, Diego Luna, Alan Tudyk, Donnie Yen",2016,133,7.9,323118,532.17,65
120,Finding Dory,"Animation,Adventure,Comedy","The friendly but forgetful blue tang fish, Dory, begins a search for her long-lost parents, and everyone learns a few things about the real meaning of family along the way.",Andrew Stanton,"Ellen DeGeneres, Albert Brooks,Ed O'Neill, Kaitlin Olson",2016,97,7.4,157026,486.29,77
95,Avengers: Age of Ultron,"Action,Adventure,Sci-Fi","When Tony Stark and Bruce Banner try to jump-start a dormant peacekeeping program called Ultron, things go horribly wrong and it's up to Earth's mightiest heroes to stop the villainous Ultron from enacting his terrible plan.",Joss Whedon,"Robert Downey Jr., Chris Evans, Mark Ruffalo, Chris Hemsworth",2015,141,7.4,516895,458.99,66
125,The Dark Knight Rises,"Action,Thriller","Eight years after the Joker's reign of anarchy, the Dark Knight, with the help of the enigmatic Selina, is forced from his imposed exile to save Gotham City, now on the edge of total annihilation, from the brutal guerrilla terrorist Bane.",Christopher Nolan,"Christian Bale, Tom Hardy, Anne Hathaway,Gary Oldman",2012,164,8.5,1222645,448.13,78
579,The Hunger Games: Catching Fire,"Action,Adventure,Mystery",Katniss Everdeen and Peeta Mellark become targets of the Capitol after their victory in the 74th Hunger Games sparks a rebellion in the Districts of Panem.,Francis Lawrence,"Jennifer Lawrence, Josh Hutcherson, Liam Hemsworth, Philip Seymour Hoffman",2013,146,7.6,525646,424.65,76
79,Pirates of the Caribbean: Dead Man's Chest,"Action,Adventure,Fantasy","Jack Sparrow races to recover the heart of Davy Jones to avoid enslaving his soul to Jones' service, as other friends and foes seek the heart for their own agenda as well.",Gore Verbinski,"Johnny Depp, Orlando Bloom, Keira Knightley, Jack Davenport",2006,151,7.3,552027,423.03,53
689,Toy Story 3,"Animation,Adventure,Comedy","The toys are mistakenly delivered to a day-care center instead of the attic right before Andy leaves for college, and it's up to Woody to convince the other toys that they weren't abandoned and to return home.",Lee Unkrich,"Tom Hanks, Tim Allen, Joan Cusack, Ned Beatty",2010,103,8.3,586669,414.98,92
280,Iron Man Three,"Action,Adventure,Sci-Fi","When Tony Stark's world is torn apart by a formidable terrorist called the Mandarin, he starts an odyssey of rebuilding and retribution.",Shane Black,"Robert Downey Jr., Guy Pearce, Gwyneth Paltrow,Don Cheadle",2013,130,7.2,591023,408.99,62
36,Captain America: Civil War,"Action,Adventure,Sci-Fi",Political interference in the Avengers' activities causes a rift between former allies Captain America and Iron Man.,Anthony Russo,"Chris Evans, Robert Downey Jr.,Scarlett Johansson, Sebastian Stan",2016,147,7.9,411656,408.08,75
152,The Hunger Games,"Adventure,Sci-Fi,Thriller",Katniss Everdeen voluntarily takes her younger sister's place in the Hunger Games: a televised competition in which two teenagers from each of the twelve Districts of Panem are chosen at random to fight to the death.,Gary Ross,"Jennifer Lawrence, Josh Hutcherson, Liam Hemsworth,Stanley Tucci",2012,142,7.2,735604,408,68
711,Transformers: Revenge of the Fallen,"Action,Adventure,Sci-Fi","Sam Witwicky leaves the Autobots behind for a normal life. But when his mind is filled with cryptic symbols, the Decepticons target him and he is dragged back into the Transformers' war.",Michael Bay,"Shia LaBeouf, Megan Fox, Josh Duhamel, Tyrese Gibson",2009,150,6,335757,402.08,35
175,Frozen,"Animation,Adventure,Comedy","When the newly crowned Queen Elsa accidentally uses her power to turn things into ice to curse her home in infinite winter, her sister, Anna, teams up with a mountain man, his playful reindeer, and a snowman to change the weather condition.",Chris Buck,"Kristen Bell, Idina Menzel, Jonathan Groff, Josh Gad",2013,102,7.5,451894,400.74,74
115,Harry Potter and the Deathly Hallows: Part 2,"Adventure,Drama,Fantasy","Harry, Ron and Hermione search for Voldemort's remaining Horcruxes in their effort to destroy the Dark Lord as the final battle rages on at Hogwarts.",David Yates,"Daniel Radcliffe, Emma Watson, Rupert Grint, Michael Gambon",2011,130,8.1,590595,380.96,87
16,The Secret Life of Pets,"Animation,Adventure,Comedy","The quiet life of a terrier named Max is upended when his owner takes in Duke, a stray whom Max instantly dislikes.",Chris Renaud,"Louis C.K., Eric Stonestreet, Kevin Hart, Lake Bell",2016,87,6.6,120259,368.31,61
798,Despicable Me 2,"Animation,Adventure,Comedy","When Gru, the world's most super-bad turned super-dad has been recruited by a team of officials to stop lethal muscle and a host of Gru's own, He has to fight back with new gadgetry, cars, and more minion madness.",Pierre Coffin,"Steve Carell, Kristen Wiig, Benjamin Bratt, Miranda Cosgrove",2013,98,7.4,304837,368.05,62
126,The Jungle Book,"Adventure,Drama,Family","After a threat from the tiger Shere Khan forces him to flee the jungle, a man-cub named Mowgli embarks on a journey of self discovery with the help of panther, Bagheera, and free spirited bear, Baloo.",Jon Favreau,"Neel Sethi, Bill Murray, Ben Kingsley, Idris Elba",2016,106,7.5,198243,364,77
34,Deadpool,"Action,Adventure,Comedy",A fast-talking mercenary with a morbid sense of humor is subjected to a rogue experiment that leaves him with accelerated healing powers and a quest for revenge.,Tim Miller,"Ryan Reynolds, Morena Baccarin, T.J. Miller, Ed Skrein",2016,108,8,627797,363.02,65
242,Inside Out,"Animation,Adventure,Comedy","After young Riley is uprooted from her Midwest life and moved to San Francisco, her emotions - Joy, Fear, Anger, Disgust and Sadness - conflict on how best to navigate a new city, house, and school.",Pete Docter,"Amy Poehler, Bill Hader, Lewis Black, Mindy Kaling",2015,95,8.2,416689,356.45,94
567,Transformers: Dark of the Moon,"Action,Adventure,Sci-Fi","The Autobots learn of a Cybertronian spacecraft hidden on the moon, and race against the Decepticons to reach it and to learn its secrets.",Michael Bay,"Shia LaBeouf, Rosie Huntington-Whiteley, Tyrese Gibson, Josh Duhamel",2011,154,6.3,338369,352.36,42
332,American Sniper,"Action,Biography,Drama","Navy S.E.A.L. sniper Chris Kyle's pinpoint accuracy saves countless lives on the battlefield and turns him into a legend. Back home to his wife and kids after four tours of duty, however, Chris finds that it is the war he can't leave behind.",Clint Eastwood,"Bradley Cooper, Sienna Miller, Kyle Gallner, Cole Konis",2014,133,7.3,353305,350.12,72
85,Furious Seven,"Action,Crime,Thriller",Deckard Shaw seeks revenge against Dominic Toretto and his family for his comatose brother.,James Wan,"Vin Diesel, Paul Walker, Dwayne Johnson, Jason Statham",2015,137,7.2,301249,350.03,67
75,Zootopia,"Animation,Adventure,Comedy","In a city of anthropomorphic animals, a rookie bunny cop and a cynical con artist fox must work together to uncover a conspiracy.",Byron Howard,"Ginnifer Goodwin, Jason Bateman, Idris Elba, Jenny Slate",2016,108,8.1,296853,341.26,78
681,The Hunger Games: Mockingjay - Part 1,"Action,Adventure,Sci-Fi","Katniss Everdeen is in District 13 after she shatters the games forever. Under the leadership of President Coin and the advice of her trusted friends, Katniss spreads her wings as she fights to save Peeta and a nation moved by her courage.",Francis Lawrence,"Jennifer Lawrence, Josh Hutcherson, Liam Hemsworth, Woody Harrelson",2014,123,6.7,331902,337.1,64
345,Spider-Man 3,"Action,Adventure","A strange black entity from another world bonds with Peter Parker and causes inner turmoil as he contends with new villains, temptations, and revenge.",Sam Raimi,"Tobey Maguire, Kirsten Dunst, Topher Grace, Thomas Haden Church",2007,139,6.2,406219,336.53,59
401,Minions,"Animation,Action,Adventure","Minions Stuart, Kevin and Bob are recruited by Scarlet Overkill, a super-villain who, alongside her inventor husband Herb, hatches a plot to take over the world.",Kyle Balda,"Sandra Bullock, Jon Hamm, Michael Keaton, Pierre Coffin",2015,91,6.4,159830,336.03,56
548,Alice in Wonderland,"Adventure,Family,Fantasy","Nineteen-year-old Alice returns to the magical world from her childhood adventure, where she reunites with her old friends and learns of her true destiny: to end the Red Queen's reign of terror.",Tim Burton,"Mia Wasikowska, Johnny Depp, Helena Bonham Carter,Anne Hathaway",2010,108,6.5,324898,334.19,53
1,Guardians of the Galaxy,"Action,Adventure,Sci-Fi",A group of intergalactic criminals are forced to work together to stop a fanatical warrior from taking control of the universe.,James Gunn,"Chris Pratt, Vin Diesel, Bradley Cooper, Zoe Saldana",2014,121,8.1,757074,333.13,76
61,Batman v Superman: Dawn of Justice,"Action,Adventure,Sci-Fi","Fearing that the actions of Superman are left unchecked, Batman takes on the Man of Steel, while the world wrestles with what kind of a hero it really needs.",Zack Snyder,"Ben Affleck, Henry Cavill, Amy Adams, Jesse Eisenberg",2016,151,6.7,472307,330.25,44
5,Suicide Squad,"Action,Adventure,Fantasy",A secret government agency recruits some of the most dangerous incarcerated super-villains to form a defensive task force. Their first mission: save the world from the apocalypse.,David Ayer,"Will Smith, Jared Leto, Margot Robbie, Viola Davis",2016,123,6.2,393727,325.02,40
213,Transformers,"Action,Adventure,Sci-Fi","An ancient struggle between two Cybertronian races, the heroic Autobots and the evil Decepticons, comes to Earth, with a clue to the ultimate power held by a teenager.",Michael Bay,"Shia LaBeouf, Megan Fox, Josh Duhamel, Tyrese Gibson",2007,144,7.1,531112,318.76,61
204,Iron Man,"Action,Adventure,Sci-Fi","After being held captive in an Afghan cave, billionaire engineer Tony Stark creates a unique weaponized suit of armor to fight evil.",Jon Favreau,"Robert Downey Jr., Gwyneth Paltrow, Terrence Howard, Jeff Bridges",2008,126,7.9,737719,318.3,79
768,Indiana Jones and the Kingdom of the Crystal Skull,"Action,Adventure,Fantasy","Famed archaeologist/adventurer Dr. Henry ""Indiana"" Jones is called back into action when he becomes entangled in a Soviet plot to uncover the secret behind mysterious artifacts known as the Crystal Skulls.",Steven Spielberg,"Harrison Ford, Cate Blanchett, Shia LaBeouf,Karen Allen",2008,122,6.2,351361,317.01,65
451,Iron Man 2,"Action,Adventure,Sci-Fi","With the world now aware of his identity as Iron Man, Tony Stark must contend with both his declining health and a vengeful mad man with ties to his father's legacy.",Jon Favreau,"Robert Downey Jr., Mickey Rourke, Gwyneth Paltrow,Don Cheadle",2010,124,7,556666,312.06,57
76,Pirates of the Caribbean: At World's End,"Action,Adventure,Fantasy","Captain Barbossa, Will Turner and Elizabeth Swann must sail off the edge of the map, navigate treachery and betrayal, find Jack Sparrow, and make their final alliances for one last decisive battle.",Gore Verbinski,"Johnny Depp, Orlando Bloom, Keira Knightley,Geoffrey Rush",2007,169,7.1,498821,309.4,50
271,Skyfall,"Action,Adventure,Thriller","Bond's loyalty to M is tested when her past comes back to haunt her. Whilst MI6 comes under attack, 007 must track down and destroy the threat, no matter how personal the cost.",Sam Mendes,"Daniel Craig, Javier Bardem, Naomie Harris, Judi Dench",2012,143,7.8,547386,304.36,81
272,The Hobbit: An Unexpected Journey,"Adventure,Fantasy","A reluctant hobbit, Bilbo Baggins, sets out to the Lonely Mountain with a spirited group of dwarves to reclaim their mountain home - and the gold within it - from the dragon Smaug.",Peter Jackson,"Martin Freeman, Ian McKellen, Richard Armitage,Andy Serkis",2012,169,7.9,668651,303,58
474,Harry Potter and the Half-Blood Prince,"Adventure,Family,Fantasy","As Harry Potter begins his sixth year at Hogwarts, he discovers an old book marked as ""the property of the Half-Blood Prince"" and begins to learn more about Lord Voldemort's dark past.",David Yates,"Daniel Radcliffe, Emma Watson, Rupert Grint, Michael Gambon",2009,153,7.5,351059,301.96,78
942,The Twilight Saga: Eclipse,"Adventure,Drama,Fantasy","As a string of mysterious killings grips Seattle, Bella, whose high school graduation is fast approaching, is forced to choose between her love for vampire Edward and her friendship with werewolf Jacob.",David Slade,"Kristen Stewart, Robert Pattinson, Taylor Lautner,Xavier Samuel",2010,124,4.9,192740,300.52,58
419,Harry Potter and the Deathly Hallows: Part 1,"Adventure,Family,Fantasy","As Harry races against time and evil to destroy the Horcruxes, he uncovers the existence of three most powerful objects in the wizarding world: the Deathly Hallows.",David Yates,"Daniel Radcliffe, Emma Watson, Rupert Grint, Bill Nighy",2010,146,7.7,357213,294.98,65
500,Up,"Animation,Adventure,Comedy","Seventy-eight year old Carl Fredricksen travels to Paradise Falls in his home equipped with balloons, inadvertently taking a young stowaway.",Pete Docter,"Edward Asner, Jordan Nagai, John Ratzenberger, Christopher Plummer",2009,96,8.3,722203,292.98,88
81,Inception,"Action,Adventure,Sci-Fi","A thief, who steals corporate secrets through use of dream-sharing technology, is given the inverse task of planting an idea into the mind of a CEO.",Christopher Nolan,"Leonardo DiCaprio, Joseph Gordon-Levitt, Ellen Page, Ken Watanabe",2010,148,8.8,1583625,292.57,74
367,The Twilight Saga: Breaking Dawn - Part 2,"Adventure,Drama,Fantasy","After the birth of Renesmee, the Cullens gather other vampire clans in order to protect the child from a false allegation that puts the family in front of the Volturi.",Bill Condon,"Kristen Stewart, Robert Pattinson, Taylor Lautner, Peter Facinelli",2012,115,5.5,194329,292.3,52
315,Harry Potter and the Order of the Phoenix,"Adventure,Family,Fantasy","With their warning about Lord Voldemort's return scoffed at, Harry and Dumbledore are targeted by the Wizard authorities as an authoritarian bureaucrat slowly seizes power at Hogwarts.",David Yates,"Daniel Radcliffe, Emma Watson, Rupert Grint, Brendan Gleeson",2007,138,7.5,385325,292,71
295,Man of Steel,"Action,Adventure,Fantasy","Clark Kent, one of the last of an extinguished race disguised as an unremarkable human, is forced to reveal his identity when Earth is invaded by an army of survivors who threaten to bring the planet to the brink of destruction.",Zack Snyder,"Henry Cavill, Amy Adams, Michael Shannon, Diane Lane",2013,143,7.1,577010,291.02,55
409,The Hunger Games: Mockingjay - Part 2,"Action,Adventure,Sci-Fi","As the war of Panem escalates to the destruction of other districts, Katniss Everdeen, the reluctant leader of the rebellion, must bring together an army against President Snow, while all she holds dear hangs in the balance.",Francis Lawrence,"Jennifer Lawrence, Josh Hutcherson, Liam Hemsworth, Woody Harrelson",2015,137,6.6,202380,281.67,65
926,The Twilight Saga: Breaking Dawn - Part 1,"Adventure,Drama,Fantasy","The Quileutes close in on expecting parents Edward and Bella, whose unborn child poses a threat to the Wolf Pack and the towns people of Forks.",Bill Condon,"Kristen Stewart, Robert Pattinson, Taylor Lautner, Gil Birmingham",2011,117,4.9,190244,281.28,45
256,The Hangover,Comedy,"Three buddies wake up from a bachelor party in Las Vegas, with no memory of the previous night and the bachelor missing. They make their way around the city in order to find their friend before his wedding.",Todd Phillips,"Zach Galifianakis, Bradley Cooper, Justin Bartha, Ed Helms",2009,100,7.8,611563,277.31,73
510,Gravity,"Drama,Sci-Fi,Thriller",Two astronauts work together to survive after an accident which leaves them alone in space.,Alfonso Cuarón,"Sandra Bullock, George Clooney, Ed Harris, Orto Ignatiussen",2013,91,7.8,622089,274.08,96
4,Sing,"Animation,Comedy,Family","In a city of humanoid animals, a hustling theater impresario's attempt to save his theater with a singing competition becomes grander than he anticipates even as its finalists' find that their lives will never be the same.",Christophe Lourdelet,"Matthew McConaughey,Reese Witherspoon, Seth MacFarlane, Scarlett Johansson",2016,108,7.2,60545,270.32,59
413,Monsters University,"Animation,Adventure,Comedy",A look at the relationship between Mike and Sulley during their days at Monsters University -- when they weren't necessarily the best of friends.,Dan Scanlon,"Billy Crystal, John Goodman, Steve Buscemi, Helen Mirren",2013,104,7.3,252119,268.49,65
369,The Amazing Spider-Man,"Action,Adventure","After Peter Parker is bitten by a genetically altered spider, he gains newfound, spider-like powers and ventures out to solve the mystery of his parent's mysterious death.",Marc Webb,"Andrew Garfield, Emma Stone, Rhys Ifans, Irrfan Khan",2012,136,7,474320,262.03,66
217,Captain America: The Winter Soldier,"Action,Adventure,Sci-Fi","As Steve Rogers struggles to embrace his role in the modern world, he teams up with a fellow Avenger and S.H.I.E.L.D agent, Black Widow, to battle a new threat from history: an assassin known as the Winter Soldier.",Anthony Russo,"Chris Evans, Samuel L. Jackson,Scarlett Johansson, Robert Redford",2014,136,7.8,542362,259.75,70
519,The Hobbit: The Desolation of Smaug,"Adventure,Fantasy","The dwarves, along with Bilbo Baggins and Gandalf the Grey, continue their quest to reclaim Erebor, their homeland, from Smaug. Bilbo Baggins is in possession of a mysterious and magical ring.",Peter Jackson,"Ian McKellen, Martin Freeman, Richard Armitage,Ken Stott",2013,161,7.9,513744,258.36,66
385,The Lego Movie,"Animation,Action,Adventure","An ordinary Lego construction worker, thought to be the prophesied 'Special', is recruited to join a quest to stop an evil tyrant from gluing the Lego universe into eternal stasis.",Phil Lord,"Chris Pratt, Will Ferrell, Elizabeth Banks, Will Arnett",2014,100,7.8,266508,257.76,83
141,Star Trek,"Action,Adventure,Sci-Fi",The brash James T. Kirk tries to live up to his father's legacy with Mr. Spock keeping him in check as a vengeful Romulan from the future creates black holes to destroy the Federation one planet at a time.,J.J. Abrams,"Chris Pine, Zachary Quinto, Simon Pegg, Leonard Nimoy",2009,127,8,526324,257.7,82
496,I Am Legend,"Drama,Horror,Sci-Fi","Years after a plague kills most of humanity and transforms the rest into monsters, the sole survivor in New York City struggles valiantly to find a cure.",Francis Lawrence,"Will Smith, Alice Braga, Charlie Tahan, Salli Richardson-Whitfield",2007,101,7.2,565721,256.39,65
311,The Blind Side,"Biography,Drama,Sport","The story of Michael Oher, a homeless and traumatized boy who became an All American football player and first round NFL draft pick with the help of a caring woman and her family.",John Lee Hancock,"Quinton Aaron, Sandra Bullock, Tim McGraw,Jae Head",2009,129,7.7,237221,255.95,53
314,The Hobbit: The Battle of the Five Armies,"Adventure,Fantasy",Bilbo and Company are forced to engage in a war against an array of combatants and keep the Lonely Mountain from falling into the hands of a rising darkness.,Peter Jackson,"Ian McKellen, Martin Freeman, Richard Armitage,Cate Blanchett",2014,144,7.4,385598,255.11,59
404,Despicable Me,"Animation,Adventure,Comedy","When a criminal mastermind uses a trio of orphan girls as pawns for a grand scheme, he finds their love is profoundly changing him for the better.",Pierre Coffin,"Steve Carell, Jason Segel, Russell Brand, Julie Andrews",2010,95,7.7,410607,251.5,72
14,Moana,"Animation,Adventure,Comedy","In Ancient Polynesia, when a terrible curse incurred by the Demigod Maui reaches an impetuous Chieftain's daughter's island, she answers the Ocean's call to seek out the Demigod to set things right.",Ron Clements,"Auli'i Cravalho, Dwayne Johnson, Rachel House, Temuera Morrison",2016,107,7.7,118151,248.75,81
127,Transformers: Age of Extinction,"Action,Adventure,Sci-Fi","Autobots must escape sight from a bounty hunter who has taken control of the human serendipity: Unexpectedly, Optimus Prime and his remaining gang turn to a mechanic, his daughter, and her back street racing boyfriend for help.",Michael Bay,"Mark Wahlberg, Nicola Peltz, Jack Reynor, Stanley Tucci",2014,165,5.7,255483,245.43,32
222,Cars,"Animation,Adventure,Comedy","A hot-shot race-car named Lightning McQueen gets waylaid in Radiator Springs, where he finds the true meaning of friendship and family.",John Lasseter,"Owen Wilson, Bonnie Hunt, Paul Newman, Larry the Cable Guy",2006,117,7.1,283445,244.05,73
229,Maleficent,"Action,Adventure,Family","A vengeful fairy is driven to curse an infant princess, only to discover that the child may be the one person who can restore peace to their troubled land.",Robert Stromberg,"Angelina Jolie, Elle Fanning, Sharlto Copley,Lesley Manville",2014,97,7,268877,241.41,56
46,Pirates of the Caribbean: On Stranger Tides,"Action,Adventure,Fantasy","Jack Sparrow and Barbossa embark on a quest to find the elusive fountain of youth, only to discover that Blackbeard and his daughter are after it too.",Rob Marshall,"Johnny Depp, Penélope Cruz, Ian McShane, Geoffrey Rush",2011,136,6.7,395025,241.06,45
135,Furious 6,"Action,Crime,Thriller","Hobbs has Dominic and Brian reassemble their crew to take down a team of mercenaries: Dominic unexpectedly gets convoluted also facing his presumed deceased girlfriend, Letty.",Justin Lin,"Vin Diesel, Paul Walker, Dwayne Johnson, Michelle Rodriguez",2013,130,7.1,318051,238.67,61
590,Brave,"Animation,Adventure,Comedy","Determined to make her own path in life, Princess Merida defies a custom that brings chaos to her kingdom. Granted one wish, Merida must rely on her bravery and her archery skills to undo a beastly curse.",Mark Andrews,"Kelly Macdonald,Billy Connolly, Emma Thompson, Julie Walters",2012,93,7.2,293941,237.28,69
441,Oz the Great and Powerful,"Adventure,Family,Fantasy","A frustrated circus magician from Kansas is transported to a magical land called Oz, where he will have to fulfill a prophecy to become the king, and release the land from the Wicked Witches using his great (but fake) powers.",Sam Raimi,"James Franco, Michelle Williams, Rachel Weisz, Mila Kunis",2013,130,6.3,181521,234.9,44
627,X-Men: The Last Stand,"Action,Adventure,Fantasy","When a cure is found to treat mutations, lines are drawn amongst the X-Men, led by Professor Charles Xavier, and the Brotherhood, a band of powerful mutants organized under Xavier's former ally, Magneto.",Brett Ratner,"Patrick Stewart, Hugh Jackman, Halle Berry, Famke Janssen",2006,104,6.7,406540,234.36,58
11,Fantastic Beasts and Where to Find Them,"Adventure,Family,Fantasy",The adventures of writer Newt Scamander in New York's secret community of witches and wizards seventy years before Harry Potter reads his book in school.,David Yates,"Eddie Redmayne, Katherine Waterston, Alison Sudol,Dan Fogler",2016,133,7.5,232072,234.02,66
163,X-Men: Days of Future Past,"Action,Adventure,Sci-Fi",The X-Men send Wolverine to the past in a desperate effort to change history and prevent an event that results in doom for both humans and mutants.,Bryan Singer,"Patrick Stewart, Ian McKellen, Hugh Jackman, James McAvoy",2014,132,8,552298,233.91,74
38,Doctor Strange,"Action,Adventure,Fantasy","While on a journey of physical and spiritual healing, a brilliant neurosurgeon is drawn into the world of the mystic arts.",Scott Derrickson,"Benedict Cumberbatch, Chiwetel Ejiofor, Rachel McAdams, Benedict Wong",2016,115,7.6,293732,232.6,72
363,Star Trek Into Darkness,"Action,Adventure,Sci-Fi","After the crew of the Enterprise find an unstoppable force of terror from within their own organization, Captain Kirk leads a manhunt to a war-zone world to capture a one-man weapon of mass destruction.",J.J. Abrams,"Chris Pine, Zachary Quinto, Zoe Saldana, Benedict Cumberbatch",2013,132,7.8,417663,228.76,72
